Product Name,Price,Rating,Seller Name
"Ambrane 20000mAh Power Bank, Rugged & Compact, 22.5W Fast Charging, Dual USB & Type-C Output, Power Delivery & Quick Charge, Travel-Friendly Compatible with iPhone, Samsung, Android (Force 20K, Black)","1,699",0.4,Cocoblu Retail
"Ambrane 20000mAh Small Pocket Size Powerbank, Hanging InBuilt Type C Cable, 22.5W Fast Charging, Type C PD & USB Output for iPhone, Android Mobiles & Other Devices (MiniCharge 20, Titanium)","1,899",0.4,Cocoblu Retail
"boAt Energyshroom PB400 Pro 20000mAh | Pocket Size, Compact Power Bank w/Type-C Input (2-Way Port), 3X Output Ports, Compatible with Tablets, Smartphones, Earbuds, Smartwatch(Emerald Green)","1,899",0.4,Cocoblu Retail
"Ambrane Magsafe Wireless 10000Mah Fast Charging USB Type-C Input Power Bank, Strong Magnet, 22.5W Output For iPhone 12 & Above, Android & Other Qi Enabled Devices + Magnetic Ring (Aerosync Snap, Blue)","1,399",0.4,Cocoblu Retail
"Xiaomi Power Bank 4i 20000mAh 33W Super Fast Charging PD | Power Delivery | QC 3.0|Type C Input & Output |Triple Output Ports|Classic Black|Supports Android,Apple, Tablets, Earbuds, Watches etc (MI)","2,199",0.4,Cocoblu Retail
"Kratos Legend Champ Power Bank 20000mAH, Fast Charging 22.5W, Triple Output (2 USB & 1 Type C), Power Delivery, Quick Charge Power Bank for iPhone, Android & Other Phones, BIS Certified,Made in India",899,0.4,Cocoblu Retail
"Xiaomi Power Bank 4i 20000mAh 33W Super Fast Charging PD | Power Delivery | QC 3.0|Type C Input & Output |Triple Output Ports|Blue|Supports Android,Apple, Tablets, Earbuds, Watches etc (MI)","2,199",0.4,Cocoblu Retail
"Xiaomi Power Bank 4i 10000mAh 22.5W Fast Charging PD | Power Delivery | QC 3.0|Type C Input & Output |Triple Output Ports|Coral Purple|Supports Android and Apple, Tablets, Earbuds, Watches etc","1,299",0.4,Cocoblu Retail
URBN 20000 mAh Premium Black Edition Nano Power Bank | 22.5W Super Fast Charging | Pocket Size| Dual Type C Power Delivery (PD) Output + 1 USB Output for Quick Charge | Two-Way Fast Charge (Black),"1,499",0.4,Cocoblu Retail
Portronics Luxcell Wireless Mini 10k 10000mAh 15W Magnetic Wireless Fast Charging Nano Power Bank with 22.5 Wired Output Compatible with iPhone 12 & Above & Other QI Enabled Devices(Black),"1,398",0.4,Cocoblu Retail
Amzon Basics 10000mAh 20W Fast Charging Power Bank and 15W Wireless Output | Type C Power Delivery (Input & Output) Quick Charge| Two Way Fast Charge | Made in India (Black),"1,299",0.4,Clicktech Retail Private Ltd
"Kratos Legend Champ Power Bank 20000 mah Fast Charging, 22.5W Quick Charge, Dual USB & Type C Output Power Delivery,LED Indicators, BIS Certified Power Bank for iPhone, Android Smartphones & Tablets",899,0.4,Cocoblu Retail
"pTron Dynamo Ultra 20000mAh Power Bank, 22.5W Superfast Charging, Compact Size, Type-C/PD 20W Fast Charging, Supports VOOC/Wrap/Dash/Quick Charge Protocols, 3 Output Ports, Type-C Input/Output (Black)","1,599",0.4,Cocoblu Retail
"pTron Newly Launched Dynamo Nergy 10000mAh 22.5W Fast Charging Power Bank, Supports VOOC/Wrap/Dash USB Charging, 20W PD Fast Charging, 3 Outputs, 1 Input & Multiple Layers of Protection (Black)",649,0.4,Cocoblu Retail
"ZEBRONICS MW60 Power Bank, 10000 mAh, Rapid Charge, 20W Output, Outputs - Dual USB | Dual Type C | Lightning, Type C PD, LED Indicator, Built in I/O Cables, Made in India (Black)",999,0.3,Cocoblu Retail
"Xiaomi Power Bank 4i 20000mAh 33W Super Fast Charging PD | Power Delivery | QC 3.0|Type C Input & Output |Triple Output Ports|Olive Green|Supports Android,Apple, Tablets, Earbuds, Watches etc (MI)","2,199",0.4,Cocoblu Retail
"Ambrane MagSafe Wireless 10000mAh Fast Charging Power Bank, Strong Magnet, 22.5W Output for iPhone 12 & Above, Android & Other Qi Enabled Devices + Magnetic Ring (Aerosync Snap, Purple)","1,499",0.4,Cocoblu Retail
"boAt Energyshroom PB400 Pro 20000mAh | Pocket Size, Compact Power Bank w/Type-C Input (2-Way Port), 3X Output Ports, Compatible with Tablets, Smartphones, Earbuds, Smartwatch(Steel Blue)","1,998",0.4,Cocoblu Retail
"Ambrane Magsafe Wireless 10000Mah Fast Charging Power Bank,Strong Magnet,22.5W Output for iPhone 12 Back Cover & Above,Android & Other Qi Enabled Devices + Magnetic Ring (Aerosync Snap,Silver)","1,348",0.4,Cocoblu Retail
"Portronics Luxcell MagClick 10k 10000 mAh 15W Magnetic Wireless Fast Charging Power Bank Premium Finish, 22.5 Wired Output Compatible with iPhone 12 & Above,Type C Smartphones,Tablets(Dark Grey)","1,498",0.4,Cocoblu Retail
"Xiaomi Power Bank 4i 10000mAh 22.5W Fast Charging PD | Power Delivery | QC 3.0|Type C Input & Output |Triple Output Ports|Classic Black|Supports Android and Apple, Tablets, Earbuds, Watches etc","1,299",0.4,Cocoblu Retail
"ZEBRONICS MB10000S4 Power Bank, 10000 mAh, 12W, Dual USB Output, Type C & Micro USB Input, Built in Protections, Percentage LED Display, Included USB to Type C Cable, Made in India",499,0.3,Cocoblu Retail
"Kratos Legend Core Power Bank 10000mah, 22.5W Fast Charging Power Bank with Type C & Dual USB Output, Ultra Slim Powerbank, Compatible for iPhone,Samsung, Oppo, Vivo, Redmi (USB C & USB A Input)",599,0.4,Cocoblu Retail
URBN Power Bank 20000mAh Fast Charging | 22.5W Super Fast Power Delivery (PD) Portable Charger | Triple Output | USB Type C Input & Output | Pass Through Charging | (Black),"1,099",0.4,Cocoblu Retail
"Lifelong ZenCharge 20000 mAh 22.5 W Compact Pocket Size Power Bank with 6 Input/Output Port (Blue, Lithium Polymer, Fast Charging, Quick Charge 3.0 for Mobile, Earbuds, Speaker, Tablet)","1,899",0.4,Cocoblu Retail
"ZEBRONICS MW63 Wireless Power Bank, 10000 mAh, Rapid Charge, Magsafe, Outputs - 20W Wired | 15W Wireless, Type C PD, Built in Protections, LED Indicator, Compatible with iPhone, Made in India","1,299",0.3,Cocoblu Retail
"pTron Newly Launched Dynamo Nergy 10000mAh 22.5W Fast Charging Power Bank, Supports VOOC/Wrap/Dash USB Charging, 20W PD Fast Charging, 3 Outputs, 1 Input & Multiple Layers of Protection (Black)",649,0.4,Cocoblu Retail
"pTron Dynamo Power 20000mAh 22.5W Super Fast Charging Power Bank with Quick Charge & 20W Power Delivery, Built-in Charging Cables, 4 Outputs, Type-C Input/Output Port & LED Battery Display (Green)","1,499",0.4,Cocoblu Retail
"Ambrane 20000mAh Powerbank, 22.5W Fast Charging, Triple Output (2 USB & 1 Type C), Power Delivery, Quick Charge for iPhone, Android & Other Devices, Made in India + Type C Cable (Stylo 20, Black)","1,498",0.3,Cocoblu Retail
"Amazon Basics 20000 mAh Power Bank | 22.5W Fast Charging | Dual Output & Input | Charge 3 Devices Simultaneously | for Smartphones, TWS Earbuds, Speakers, Tablets (Dark Blue)",Out of Stock,0.3,Clicktech Retail Private Ltd
"ZEBRONICS MW64 Compact Power Bank, 10000 mAh, Rapid Charge, 22.5W Output, Outputs - Type C Cable | Type C Port | Lightning Port, Percentage Indicator, Made in India (White)","1,299",0.3,Cocoblu Retail
"Stuffcool Lucid Plus 15W Magnetic Wireless Powerbank with Stand for AirPods Pro, iPhone 12/13/14/15/16, Flagship Android and 20W Fast Wired Charging","2,999",0.4,Cocoblu Retail
"Lifelong ZenCharge 10000 mAh 22.5 W Compact Pocket Size Power Bank with 6 Input/Output Port (Peach, Lithium Polymer, Fast Charging, Quick Charge 3.0 for Mobile, Earbuds, Speaker, Tablet)","1,399",0.4,Cocoblu Retail
